{
  "schemaVersion": 1,
  "id": "heroine",
  "label": "Heroine",
  "rigId": "humanoid_v1",
  "headPartId": "head",
  "headTemplateId": "humanoid_v1_head",
  "canvas": { "width": 1254, "height": 1254 },
  "defaultSetId": "neutral",
  "status": "ready",
  "approvedReference": "assets/images/characters/face_profiles/heroine/reference/approved_neutral.png",
  "parts": {
    "eyes": "assets/images/characters/face_profiles/heroine/eyes/",
    "noses": "assets/images/characters/face_profiles/heroine/noses/",
    "mouths": "assets/images/characters/face_profiles/heroine/mouths/",
    "details": "assets/images/characters/face_profiles/heroine/details/"
  },
  "sets": "assets/images/characters/face_profiles/heroine/sets.json"
}
